{
  "schema_version": "sg1.v1",
  "frame_id": 576,
  "timestamp_ms": 23040,
  "image_width": 1920,
  "image_height": 1080,
  "landmark_topology": "mediapipe_face_landmarker_478",
  "config_name": "lower_resolution",
  "status": "NO_FACE",
  "face_bbox_xyxy": null,
  "landmarks_xy_normalized": [],
  "landmark_count": 0,
  "detection_confidence": null,
  "inference_ms": 5.479899991769344
}
